{
  "name": "ColorRoleScale",
  "type": "enum",
  "description": "Именованные семантические роли цвета",
  "values": [
    { "name": "primary", "description": "Основной акцентный цвет: главные действия и активные элементы" },
    { "name": "onPrimary", "description": "Текст и иконки поверх primary" },
    { "name": "primaryContainer", "description": "Приглушённый фон акцентных элементов" },
    { "name": "onPrimaryContainer", "description": "Текст и иконки поверх primaryContainer" },
    { "name": "secondary", "description": "Второстепенный акцентный цвет" },
    { "name": "onSecondary", "description": "Текст и иконки поверх secondary" },
    { "name": "secondaryContainer", "description": "Приглушённый фон второстепенных акцентных элементов" },
    { "name": "onSecondaryContainer", "description": "Текст и иконки поверх secondaryContainer" },
    { "name": "tertiary", "description": "Дополнительный акцентный цвет для выделения и контраста" },
    { "name": "onTertiary", "description": "Текст и иконки поверх tertiary" },
    { "name": "tertiaryContainer", "description": "Приглушённый фон дополнительных акцентных элементов" },
    { "name": "onTertiaryContainer", "description": "Текст и иконки поверх tertiaryContainer" },
    { "name": "error", "description": "Ошибки и деструктивные действия" },
    { "name": "onError", "description": "Текст и иконки поверх error" },
    { "name": "errorContainer", "description": "Приглушённый фон сообщений об ошибке" },
    { "name": "onErrorContainer", "description": "Текст и иконки поверх errorContainer" },
    { "name": "success", "description": "Успешное выполнение и положительный статус" },
    { "name": "onSuccess", "description": "Текст и иконки поверх success" },
    { "name": "successContainer", "description": "Приглушённый фон сообщений об успехе" },
    { "name": "onSuccessContainer", "description": "Текст и иконки поверх successContainer" },
    { "name": "warning", "description": "Предупреждения и статусы, требующие внимания" },
    { "name": "onWarning", "description": "Текст и иконки поверх warning" },
    { "name": "warningContainer", "description": "Приглушённый фон предупреждений" },
    { "name": "onWarningContainer", "description": "Текст и иконки поверх warningContainer" },
    { "name": "info", "description": "Информационные сообщения и нейтральные статусы" },
    { "name": "onInfo", "description": "Текст и иконки поверх info" },
    { "name": "infoContainer", "description": "Приглушённый фон информационных сообщений" },
    { "name": "onInfoContainer", "description": "Текст и иконки поверх infoContainer" },
    { "name": "background", "description": "Фон экрана" },
    { "name": "surface", "description": "Базовая поверхность: карточки, листы, панели" },
    { "name": "surface1", "description": "Поверхность первого уровня, контрастнее surface" },
    { "name": "surface2", "description": "Поверхность второго уровня" },
    { "name": "surface3", "description": "Поверхность третьего уровня, наиболее контрастная" },
    { "name": "inverseSurface", "description": "Инверсная поверхность: снекбары, подсказки" },
    { "name": "inverseOnSurface", "description": "Текст и иконки поверх inverseSurface" },
    { "name": "onSurface", "description": "Основной текст и иконки поверх поверхностей и фона" },
    { "name": "onSurfaceVariant", "description": "Второстепенный текст и иконки" },
    { "name": "onSurfaceMuted", "description": "Приглушённый текст и иконки: подсказки, неактивные элементы" },
    { "name": "outline", "description": "Обводки и разделители" },
    { "name": "outlineStrong", "description": "Контрастные обводки: границы полей ввода" },
    { "name": "scrim", "description": "Затемнение под модальными элементами" },
    { "name": "overlayPressed", "description": "Полупрозрачное наложение для состояния нажатия" },
    { "name": "overlayNeutral", "description": "Нейтральное полупрозрачное наложение" },
    { "name": "overlayNeutralPressed", "description": "Нейтральное полупрозрачное наложение в состоянии нажатия" }
  ]
}
