{
  "name": "LayoutDimension",
  "type": "object",
  "description": "Размер компонента по одной оси",
  "properties": [
    {
      "name": "sizing",
      "$ref": "LayoutSizing",
      "required": true,
      "description": "Способ задания размера: по содержимому, по доступному пространству или фиксированный"
    },
    {
      "name": "min",
      "$ref": "../../foundation/size/Size",
      "required": false,
      "sample": "xs",
      "description": "Минимальный размер"
    },
    {
      "name": "max",
      "$ref": "../../foundation/size/Size",
      "required": false,
      "sample": { "custom": { "value": 240 } },
      "description": "Максимальный размер"
    }
  ]
}
