{
  "name": "SizeScale",
  "type": "enum",
  "description": "Именованные значения шкалы размеров",
  "values": [
    { "name": "zero", "description": "Нулевой размер, 0 условных единиц" },
    { "name": "xs2", "description": "Минимальный размер, по умолчанию 12 условных единиц" },
    { "name": "xs", "description": "Очень маленький размер, по умолчанию 16 условных единиц" },
    { "name": "s", "description": "Маленький размер, по умолчанию 24 условные единицы" },
    { "name": "m", "description": "Средний размер, по умолчанию 32 условные единицы" },
    { "name": "l", "description": "Большой размер, по умолчанию 40 условных единиц" },
    { "name": "xl", "description": "Очень большой размер, по умолчанию 48 условных единиц" },
    { "name": "xl2", "description": "Крупный размер, по умолчанию 56 условных единиц" },
    { "name": "xl3", "description": "Максимальный размер шкалы, по умолчанию 64 условные единицы" }
  ]
}
