{
  "name": "ColorPalette",
  "type": "enum",
  "description": "Внутренняя палитра темы default. Имя цвета — семейство оттенка и тон (светлота от 0 до 100). На платформах не публикуется; используется только алиасами файлов значений темы",
  "values": [
    { "name": "white", "description": "Белый" },
    { "name": "black", "description": "Чёрный" },
    { "name": "warmGray98", "description": "Тёплый серый, тон 98" },
    { "name": "warmGray95", "description": "Тёплый серый, тон 95" },
    { "name": "warmGray90", "description": "Тёплый серый, тон 90" },
    { "name": "warmGray83", "description": "Тёплый серый, тон 83" },
    { "name": "warmGray74", "description": "Тёплый серый, тон 74" },
    { "name": "warmGray64", "description": "Тёплый серый, тон 64" },
    { "name": "warmGray60", "description": "Тёплый серый, тон 60" },
    { "name": "warmGray44", "description": "Тёплый серый, тон 44" },
    { "name": "warmGray35", "description": "Тёплый серый, тон 35" },
    { "name": "warmGray23", "description": "Тёплый серый, тон 23" },
    { "name": "warmGray17", "description": "Тёплый серый, тон 17" },
    { "name": "warmGray12", "description": "Тёплый серый, тон 12" },
    { "name": "warmGray8", "description": "Тёплый серый, тон 8" },
    { "name": "warmGray6", "description": "Тёплый серый, тон 6" },
    { "name": "warmGray5", "description": "Тёплый серый, тон 5" },
    { "name": "gold94", "description": "Золотой, тон 94" },
    { "name": "gold77", "description": "Золотой, тон 77" },
    { "name": "gold68", "description": "Золотой, тон 68" },
    { "name": "gold26", "description": "Золотой, тон 26" },
    { "name": "ochre93", "description": "Охра, тон 93" },
    { "name": "ochre87", "description": "Охра, тон 87" },
    { "name": "ochre49", "description": "Охра, тон 49" },
    { "name": "ochre17", "description": "Охра, тон 17" },
    { "name": "ochre11", "description": "Охра, тон 11" },
    { "name": "amber92", "description": "Янтарный, тон 92" },
    { "name": "amber86", "description": "Янтарный, тон 86" },
    { "name": "amber48", "description": "Янтарный, тон 48" },
    { "name": "amber19", "description": "Янтарный, тон 19" },
    { "name": "plum94", "description": "Сливовый, тон 94" },
    { "name": "plum86", "description": "Сливовый, тон 86" },
    { "name": "plum62", "description": "Сливовый, тон 62" },
    { "name": "plum35", "description": "Сливовый, тон 35" },
    { "name": "plum18", "description": "Сливовый, тон 18" },
    { "name": "plum9", "description": "Сливовый, тон 9" },
    { "name": "red91", "description": "Красный, тон 91" },
    { "name": "red80", "description": "Красный, тон 80" },
    { "name": "red40", "description": "Красный, тон 40" },
    { "name": "red31", "description": "Красный, тон 31" },
    { "name": "red20", "description": "Красный, тон 20" },
    { "name": "red12", "description": "Красный, тон 12" },
    { "name": "green92", "description": "Зелёный, тон 92" },
    { "name": "green82", "description": "Зелёный, тон 82" },
    { "name": "green42", "description": "Зелёный, тон 42" },
    { "name": "green23", "description": "Зелёный, тон 23" },
    { "name": "green17", "description": "Зелёный, тон 17" },
    { "name": "green11", "description": "Зелёный, тон 11" },
    { "name": "blue91", "description": "Синий, тон 91" },
    { "name": "blue81", "description": "Синий, тон 81" },
    { "name": "blue40", "description": "Синий, тон 40" },
    { "name": "blue19", "description": "Синий, тон 19" }
  ]
}
