{
  "name": "LayoutPinOffset",
  "type": "object",
  "description": "Закрепление к стороне или центру родителя со смещением",
  "properties": [
    {
      "name": "offset",
      "$ref": "foundation/spacing/Spacing",
      "required": true,
      "description": "Смещение от стороны или центра родителя"
    }
  ]
}
