{
  "name": "ComponentIndicatorAnchor",
  "type": "enum",
  "description": "Угол формы носителя, в точку которого ставится центр индикатора: у прямого угла — вершина, у скруглённого — середина дуги",
  "values": [
    {
      "name": "topStart",
      "description": "Верхний угол со стороны начала строки"
    },
    {
      "name": "topEnd",
      "description": "Верхний угол со стороны конца строки"
    },
    {
      "name": "bottomStart",
      "description": "Нижний угол со стороны начала строки"
    },
    {
      "name": "bottomEnd",
      "description": "Нижний угол со стороны конца строки"
    }
  ]
}
