{
  "name": "BorderWidthScale",
  "type": "enum",
  "description": "Именованные значения шкалы толщины обводки",
  "values": [
    { "name": "zero", "description": "Без обводки, 0 условных единиц" },
    { "name": "s", "description": "Обычная обводка и разделители, по умолчанию 1 условная единица" },
    { "name": "m", "description": "Выделение: фокус, выбранный элемент, по умолчанию 2 условные единицы" },
    { "name": "l", "description": "Акцентная обводка и индикаторы, по умолчанию 4 условные единицы" }
  ]
}
