{
  "name": "Component",
  "type": "object",
  "description": "Базовая модель компонента. Каждый компонент содержит поля базовой модели",
  "releaseVersions": {
    "figma": "released",
    "android": "notReleased",
    "ios": "notReleased"
  },
  "properties": [
    {
      "name": "id",
      "type": "string",
      "required": false,
      "description": "Идентификатор компонента: UI-тесты, источник событий, ключ элемента в списках, аналитика. Если задан, уникален в пределах дерева модели"
    },
    {
      "name": "layout",
      "$ref": "core/layout/Layout",
      "required": true,
      "description": "Размеры и положение компонента внутри родителя"
    },
    {
      "name": "padding",
      "$ref": "core/padding/Padding",
      "required": true,
      "description": "Внутренние отступы корня компонента"
    },
    {
      "name": "appearance",
      "$ref": "core/appearance/Appearance",
      "required": true,
      "description": "Оформление корня компонента по состояниям: фон, тень, скругление, обводка, обрезка"
    },
    {
      "name": "indicators",
      "type": "array",
      "items": {
        "$ref": "ComponentIndicator"
      },
      "required": false,
      "description": "Индикаторы у углов формы компонента: точка, символ, счётчик. Компонент вырезает их из своей формы с зазором; размер компонента в раскладке не меняется"
    },
    {
      "name": "events",
      "type": "array",
      "items": {
        "$ref": "core/event/Event"
      },
      "uniqueVariants": true,
      "required": false,
      "description": "События, которые компонент передаёт приложению, с данными о том, что нужно сделать. Каждое событие задаётся не более одного раза",
      "releaseVersions": {
        "figma": "willNotBeReleased"
      }
    }
  ]
}
