{
  "name": "ComponentIndicator",
  "type": "object",
  "description": "Индикатор у угла носителя: рисуется поверх, может выступать за границы и не меняет размер носителя в раскладке",
  "properties": [
    {
      "name": "anchor",
      "$ref": "ComponentIndicatorAnchor",
      "required": true,
      "sample": "topEnd",
      "description": "Угол формы носителя, в точку которого ставится центр индикатора"
    },
    {
      "name": "content",
      "$ref": "Component",
      "required": true,
      "description": "Индикатор: любой компонент с размером hug или fixed"
    },
    {
      "name": "gap",
      "$ref": "../../foundation/spacing/Spacing",
      "required": false,
      "sample": "xs2",
      "description": "Зазор выреза: носитель вырезает форму индикатора, расширенную на зазор. Если не задан, выреза нет"
    }
  ]
}
